<?xml version="1.0" encoding="utf-8"?>
<OcaDevice xmlns:occmembers="http://www.w3.org/2001/XMLSchema-instance" occmembers:noNamespaceSchemaLocation="ReferenceOCCMembers.xsd">
    <!-- Root segment[1]:
            Anything specific to both Managers and RootBlocks can be added here-->
    <Root Label="Root" Name="OcaRoot" ClassID="1">
        <Versions>
            <Version OcaVersion="AES70-2015" ClassVersion="1"/>
            <Version OcaVersion="AES70-2018" ClassVersion="2"/>
        </Versions>
        <Methods>
            <Method Name="GetClassIdentification" Index="1">
                <MandatoryMap>
                    <!-- Mandatory from OCA version AES70-2015 -->
                    <Mandatory OcaVersion="AES70-2015" Mandatory="true"/>
                </MandatoryMap>
            </Method>
            <Method Name="GetLockable" Index="2">
                <MandatoryMap>
                    <!-- Mandatory from OCA version AES70-2015 -->
                    <Mandatory OcaVersion="AES70-2015" Mandatory="true"/>
                </MandatoryMap>
            </Method>
            <Method Name="Lock" Index="3">
                <MandatoryMap>
                    <!-- Mandatory from OCA version AES70-2015, only if lockable -->
                    <Mandatory OcaVersion="AES70-2015" Mandatory="true"/>
                </MandatoryMap>
            </Method>
            <Method Name="Unlock" Index="4">
                <MandatoryMap>
                    <!-- Mandatory from OCA version AES70-2015, only if lockable -->
                    <Mandatory OcaVersion="AES70-2015" Mandatory="true"/>
                </MandatoryMap>
            </Method>
            <Method Name="GetRole" Index="5"  />
            <Method Name="LockReadOnly" Index="6" AvailableSince="AES70-2018" />
        </Methods>
        <Events>
            <Event Name="PropertyChanged" Index="1">
                <MandatoryMap>
                    <!-- Mandatory from OCA version AES70-2015 -->
                    <Mandatory OcaVersion="AES70-2015" Mandatory="true"/>
                </MandatoryMap>
            </Event>
        </Events>
    </Root>
    <!-- Managers segment[2]:
            Anything specific to managers can be added here as an attribute -->
    <Managers Label="Managers">
        <!-- OcaManager doesn't contain any method -->
        <!-- OcaRoot.OcaManager -->
        <Manager Name="OcaManager" ClassID="1.3">
        </Manager>
        <!-- OcaRoot.OcaManager.OcaDeviceManager -->
        <Manager Name="OcaDeviceManager" ClassID="1.3.1" ObjNumber="1">
            <MandatoryMap>
                <!-- Mandatory from OCA version AES70-2015 -->
                <Mandatory OcaVersion="AES70-2015" Mandatory="true"/>
            </MandatoryMap>
            <Methods>
                <Method Name="GetOcaVersion" Index="1">
                    <MandatoryMap>
                        <!-- Mandatory from OCA version AES70-2015 -->
                        <Mandatory OcaVersion="AES70-2015" Mandatory="true"/>
                    </MandatoryMap>
                </Method>
                <Method Name="GetModelGUID" Index="2">
                    <MandatoryMap>
                        <!-- Mandatory from OCA version AES70-2015 -->
                        <Mandatory OcaVersion="AES70-2015" Mandatory="true"/>
                    </MandatoryMap>
                </Method>
                <Method Name="GetSerialNumber" Index="3">
                    <MandatoryMap>
                        <!-- Mandatory from OCA version AES70-2015 -->
                        <Mandatory OcaVersion="AES70-2015" Mandatory="true"/>
                    </MandatoryMap>
                </Method>
                <Method Name="GetDeviceName" Index="4">
                    <MandatoryMap>
                        <!-- Mandatory from OCA version AES70-2015 -->
                        <Mandatory OcaVersion="AES70-2015" Mandatory="true"/>
                    </MandatoryMap>
                </Method>
                <Method Name="GetModelDescription" Index="6">
                    <MandatoryMap>
                        <!-- Mandatory from OCA version AES70-2015 -->
                        <Mandatory OcaVersion="AES70-2015" Mandatory="true"/>
                    </MandatoryMap>
                </Method>
                <Method Name="GetEnabled" Index="11">
                    <MandatoryMap>
                        <!-- Mandatory from OCA version AES70-2015 -->
                        <Mandatory OcaVersion="AES70-2015" Mandatory="true"/>
                    </MandatoryMap>
                </Method>
                <Method Name="SetEnabled" Index="12">
                    <MandatoryMap>
                        <Mandatory OcaVersion="AES70-2015" Mandatory="true"/>
                    </MandatoryMap>
                </Method>
                <Method Name="GetState" Index="13">
                    <MandatoryMap>
                        <!-- Mandatory from OCA version AES70-2015 -->
                        <Mandatory OcaVersion="AES70-2015" Mandatory="true"/>
                    </MandatoryMap>
                </Method>
                <Method Name="GetManagers" Index="19">
                    <MandatoryMap>
                        <!-- Mandatory from OCA version AES70-2015 -->
                        <Mandatory OcaVersion="AES70-2015" Mandatory="true"/>
                    </MandatoryMap>
                </Method>
                <Method Name="GetDeviceRevisionID" Index="20" AvailableSince="AES70-2018">
                    <MandatoryMap>
                        <!-- Mandatory from OCA version AES70-2018 -->
                        <Mandatory OcaVersion="AES70-2018" Mandatory="true"/>
                    </MandatoryMap>
                </Method>
                <!-- Optional members -->
                <Method Name="SetDeviceName" Index="5" />
                <Method Name="GetDeviceRole" Index="7" />
                <Method Name="SetDeviceRole" Index="8" />
                <Method Name="GetUserInventoryCode" Index="9" />
                <Method Name="SetUserInventoryCode" Index="10" />
                <Method Name="SetResetKey" Index="14" />
                <Method Name="GetResetCause" Index="15" />
                <Method Name="ClearResetCase" Index="16" />
                <Method Name="GetMessage" Index="17" />
                <Method Name="SetMessage" Index="18" />
            </Methods>
        </Manager>
        <!-- OcaRoot.OcaManager.OcaSecurityManager -->
        <Manager Name="OcaSecurityManager" ClassID="1.3.2" ObjNumber="2">
            <MandatoryMap>
                <!-- Not mandatory from OCA version AES70-2015 -->
                <Mandatory OcaVersion="AES70-2015" Mandatory="true" DeviceType="Secure"/>
            </MandatoryMap>
            <Methods>
                <Method Name="EnableControlSecurity" Index="1" ConnectionType="Secure">
                    <MandatoryMap>
                        <!-- Mandatory from OCA version AES70-2015 -->
                        <Mandatory OcaVersion="AES70-2015" Mandatory="true"/>
                    </MandatoryMap>
                </Method>
                <Method Name="DisableControlSecurity" Index="2" ConnectionType="Secure">
                    <MandatoryMap>
                        <!-- Mandatory from OCA version AES70-2015 -->
                        <Mandatory OcaVersion="AES70-2015" Mandatory="true"/>
                    </MandatoryMap>
                </Method>
                <Method Name="ChangePreSharedKey" Index="3" ConnectionType="Secure">
                    <MandatoryMap>
                        <!-- Mandatory from OCA version AES70-2015 -->
                        <Mandatory OcaVersion="AES70-2015" Mandatory="true"/>
                    </MandatoryMap>
                </Method>
                <Method Name="AddPreSharedKey" Index="4" ConnectionType="Secure">
                    <MandatoryMap>
                        <!-- Mandatory from OCA version AES70-2015 -->
                        <Mandatory OcaVersion="AES70-2015" Mandatory="true"/>
                    </MandatoryMap>
                </Method>
                <Method Name="DeletePreSharedKey" Index="5" ConnectionType="Secure">
                    <MandatoryMap>
                        <!-- Mandatory from OCA version AES70-2015 -->
                        <Mandatory OcaVersion="AES70-2015" Mandatory="true"/>
                    </MandatoryMap>
                </Method>
            </Methods>
        </Manager>
        <!-- OcaRoot.OcaManager.OcaFirmwareManager -->
        <Manager Name="OcaFirmwareManager" ClassID="1.3.3" ObjNumber="3">
            <MandatoryMap>
                <!-- Mandatory from OCA version AES70-2015 -->
                <Mandatory OcaVersion="AES70-2015" Mandatory="true"/>
                 <!-- No longer mandatory from OCA version AES70-2018 -->
                <Mandatory OcaVersion="AES70-2018" Mandatory="false"/>
            </MandatoryMap>
            <Methods>
                <Method Name="GetComponentVersions" Index="1">
                    <MandatoryMap>
                        <!-- Mandatory from OCA version AES70-2015 -->
                        <Mandatory OcaVersion="AES70-2015" Mandatory="true"/>
                    </MandatoryMap>
                </Method>
            </Methods>
        </Manager>
        <!-- OcaRoot.OcaManager.OcaSubscriptionManager -->
        <Manager Name="OcaSubscriptionManager" ClassID="1.3.4" ObjNumber="4">
            <MandatoryMap>
                <!-- Mandatory from OCA version AES70-2015 -->
                <Mandatory OcaVersion="AES70-2015" Mandatory="true"/>
                <!-- No longer mandatory from OCA version AES70-2018-->
                <Mandatory OcaVersion="AES70-2018" Mandatory="false"/>
            </MandatoryMap>